{
  "artifact_sets": [
    {
      "file_count": 244,
      "path": "qualification/evidence/PROTO-01/axis-combined/artifacts",
      "sha256": "2d5eb67844864b8bfc6f4f71d23a1043ab89039cc8eec8d1279d738c1fc28658",
      "total_bytes": 5978725
    },
    {
      "file_count": 570,
      "path": "qualification/evidence/PROTO-01/broad-combined/artifacts",
      "sha256": "f1efae4082a0421934d28d47a5fe4411e3d45b4277ffe7845fcb0d30168e8409",
      "total_bytes": 170870217
    }
  ],
  "record_count": 35,
  "records": [
    {
      "path": "qualification/evidence/PROTO-01/ahb-1.0/cocotb-evidence-v1.json",
      "profile_id": "ahb-1.0",
      "role": "subordinate",
      "sha256": "22d85e7f3aeeca1532bba7cefffd197e77a041322d3be415148d33d28fcbbaad",
      "target": "cocotb"
    },
    {
      "path": "qualification/evidence/PROTO-01/ahb-1.0/formal-evidence-v1.json",
      "profile_id": "ahb-1.0",
      "role": "subordinate",
      "sha256": "8939a6e357cbe23c2daa27ac398b00145957b22a485ff215d0abf5a0e4a3ea4f",
      "target": "formal"
    },
    {
      "path": "qualification/evidence/PROTO-01/ahb-1.0/systemverilog-evidence-v1.json",
      "profile_id": "ahb-1.0",
      "role": "subordinate",
      "sha256": "823498cfde04309b28fb012a1996e7830001153a766ba32fe0ca0583c87033e4",
      "target": "systemverilog"
    },
    {
      "path": "qualification/evidence/PROTO-01/ahb-1.0/verilog-evidence-v1.json",
      "profile_id": "ahb-1.0",
      "role": "subordinate",
      "sha256": "dff66cb9cd69eb89582f687b78c406591d99b5e91eaa024ed7495716d37f3ed4",
      "target": "verilog"
    },
    {
      "path": "qualification/evidence/PROTO-01/ahb-1.0/vhdl-evidence-v1.json",
      "profile_id": "ahb-1.0",
      "role": "subordinate",
      "sha256": "0e314f8dd8a02bb803703fa3d0cce0aabc2f137b2b0c375a862e5875f9d8593b",
      "target": "vhdl"
    },
    {
      "path": "qualification/evidence/PROTO-01/avalon-mm-1.0/cocotb-evidence-v1.json",
      "profile_id": "avalon-mm-1.0",
      "role": "agent",
      "sha256": "d27e7163a388f774839a0a1222d55adfa6509a5bf7659b37d92eda528b62c358",
      "target": "cocotb"
    },
    {
      "path": "qualification/evidence/PROTO-01/avalon-mm-1.0/formal-evidence-v1.json",
      "profile_id": "avalon-mm-1.0",
      "role": "agent",
      "sha256": "bd9404aa58e2fc95eaf13b59698caa3054ed2d3bbd0a99dfb87c7cb344bae8c5",
      "target": "formal"
    },
    {
      "path": "qualification/evidence/PROTO-01/avalon-mm-1.0/systemverilog-evidence-v1.json",
      "profile_id": "avalon-mm-1.0",
      "role": "agent",
      "sha256": "017bf6a783d9dc96f15a7ef77f341f27c1b7e02243b5a863d8ddc566d5ca33f9",
      "target": "systemverilog"
    },
    {
      "path": "qualification/evidence/PROTO-01/avalon-mm-1.0/verilog-evidence-v1.json",
      "profile_id": "avalon-mm-1.0",
      "role": "agent",
      "sha256": "f3da564c480440b1b6e396bb7f254d370d42a53625e960c7dc2a9b88d9633c40",
      "target": "verilog"
    },
    {
      "path": "qualification/evidence/PROTO-01/avalon-mm-1.0/vhdl-evidence-v1.json",
      "profile_id": "avalon-mm-1.0",
      "role": "agent",
      "sha256": "8750a03c006b0d2e55a3d6384f0d94e47c15ea33a99ad3721275204bc9cf5d95",
      "target": "vhdl"
    },
    {
      "path": "qualification/evidence/PROTO-01/avalon-st-1.0/cocotb-evidence-v1.json",
      "profile_id": "avalon-st-1.0",
      "role": "sink",
      "sha256": "490abe2407f5a29de1877f438982532581c829d65530272f6fab38f4f91700f5",
      "target": "cocotb"
    },
    {
      "path": "qualification/evidence/PROTO-01/avalon-st-1.0/formal-evidence-v1.json",
      "profile_id": "avalon-st-1.0",
      "role": "sink",
      "sha256": "a684047c4740390a738dc3496a282f101b31356f171af171e706bc4ebeebb795",
      "target": "formal"
    },
    {
      "path": "qualification/evidence/PROTO-01/avalon-st-1.0/systemverilog-evidence-v1.json",
      "profile_id": "avalon-st-1.0",
      "role": "sink",
      "sha256": "37da01764b49022cd57c7c0e0b2d6e61d91fd0e31ae8e50b13d587f3392ba9fe",
      "target": "systemverilog"
    },
    {
      "path": "qualification/evidence/PROTO-01/avalon-st-1.0/verilog-evidence-v1.json",
      "profile_id": "avalon-st-1.0",
      "role": "sink",
      "sha256": "a7607d3d79d065e43fb88fffc63ced889b08ba62f18a847304dd25c7b7f0bcc4",
      "target": "verilog"
    },
    {
      "path": "qualification/evidence/PROTO-01/avalon-st-1.0/vhdl-evidence-v1.json",
      "profile_id": "avalon-st-1.0",
      "role": "sink",
      "sha256": "c3a6dd5dc09463b6fdeea4ef3ccf32e4b9e5a438e6a9ce680038ff2d3705f41e",
      "target": "vhdl"
    },
    {
      "path": "qualification/evidence/PROTO-01/axi4-1.0/cocotb-evidence-v1.json",
      "profile_id": "axi4-1.0",
      "role": "subordinate",
      "sha256": "9ffd531990478f2c253dfddadc115d53ec945608075ba8e954f9abf20724d02b",
      "target": "cocotb"
    },
    {
      "path": "qualification/evidence/PROTO-01/axi4-1.0/formal-evidence-v1.json",
      "profile_id": "axi4-1.0",
      "role": "subordinate",
      "sha256": "ee1ac26e882ab122c4706a96b6e4edaf9f013d37f8474f91d5942bc56be4cc21",
      "target": "formal"
    },
    {
      "path": "qualification/evidence/PROTO-01/axi4-1.0/systemverilog-evidence-v1.json",
      "profile_id": "axi4-1.0",
      "role": "subordinate",
      "sha256": "309bfb444084343229cc880717b8aa1da9fcea726e4e1ce3637f6b531b5fc8f4",
      "target": "systemverilog"
    },
    {
      "path": "qualification/evidence/PROTO-01/axi4-1.0/verilog-evidence-v1.json",
      "profile_id": "axi4-1.0",
      "role": "subordinate",
      "sha256": "a447a8ab0ff6890b5241a8c50b68c91ddde53f317f448ccda704ae0c9dc3d2f3",
      "target": "verilog"
    },
    {
      "path": "qualification/evidence/PROTO-01/axi4-1.0/vhdl-evidence-v1.json",
      "profile_id": "axi4-1.0",
      "role": "subordinate",
      "sha256": "a537cc756a37441d3060c6728be4a8a4a4dbabc89048706710922acb91e48c5f",
      "target": "vhdl"
    },
    {
      "path": "qualification/evidence/PROTO-01/axi4-stream-1.0/cocotb-evidence-v1.json",
      "profile_id": "axi4-stream-1.0",
      "role": "source",
      "sha256": "220719a662223d3376a0ab3a016337fb4c26c6c59aeffe8c0766286a1c696013",
      "target": "cocotb"
    },
    {
      "path": "qualification/evidence/PROTO-01/axi4-stream-1.0/formal-evidence-v1.json",
      "profile_id": "axi4-stream-1.0",
      "role": "source",
      "sha256": "59d99b9aa756d2ef3e6a8182c6a667bea2cd2109427656b561e9de75a98a0a40",
      "target": "formal"
    },
    {
      "path": "qualification/evidence/PROTO-01/axi4-stream-1.0/systemverilog-evidence-v1.json",
      "profile_id": "axi4-stream-1.0",
      "role": "source",
      "sha256": "5e8743ac99e98f57e0020bd87d5fea9cde1f325a11fd82775df7d7b299966221",
      "target": "systemverilog"
    },
    {
      "path": "qualification/evidence/PROTO-01/axi4-stream-1.0/verilog-evidence-v1.json",
      "profile_id": "axi4-stream-1.0",
      "role": "source",
      "sha256": "a2239a2b9edde04add475350d20dd026d7f13cbbe8905fa883920cae434c7c85",
      "target": "verilog"
    },
    {
      "path": "qualification/evidence/PROTO-01/axi4-stream-1.0/vhdl-evidence-v1.json",
      "profile_id": "axi4-stream-1.0",
      "role": "source",
      "sha256": "2dc5ceabb19b431033b28494aa162b41ca713359a748afd921174c8246736594",
      "target": "vhdl"
    },
    {
      "path": "qualification/evidence/PROTO-01/tilelink-ul-uh-1.0/cocotb-evidence-v1.json",
      "profile_id": "tilelink-ul-uh-1.0",
      "role": "subordinate",
      "sha256": "f6d71ed09f42597e9c5890b7a0fcacf1e5c6c970a3f6fdedabf547720e89f92f",
      "target": "cocotb"
    },
    {
      "path": "qualification/evidence/PROTO-01/tilelink-ul-uh-1.0/formal-evidence-v1.json",
      "profile_id": "tilelink-ul-uh-1.0",
      "role": "subordinate",
      "sha256": "c9f99d18d74427e1255469be289b1d7b03a6f6e359bbe4ea7427c1cd553d04d5",
      "target": "formal"
    },
    {
      "path": "qualification/evidence/PROTO-01/tilelink-ul-uh-1.0/systemverilog-evidence-v1.json",
      "profile_id": "tilelink-ul-uh-1.0",
      "role": "subordinate",
      "sha256": "49ea61bf0e2d73c19ab91e512aa8cfc3a776e06e7558656701546c6f94d69887",
      "target": "systemverilog"
    },
    {
      "path": "qualification/evidence/PROTO-01/tilelink-ul-uh-1.0/verilog-evidence-v1.json",
      "profile_id": "tilelink-ul-uh-1.0",
      "role": "subordinate",
      "sha256": "413eb4a8072f02e5dea5c2afdcb2b714b8dbad426d20aa8c39e17a9a1da5d4c2",
      "target": "verilog"
    },
    {
      "path": "qualification/evidence/PROTO-01/tilelink-ul-uh-1.0/vhdl-evidence-v1.json",
      "profile_id": "tilelink-ul-uh-1.0",
      "role": "subordinate",
      "sha256": "529a46af3a6ad72e25ebf5fc2aaaba86d86a52f569e1ea9deaad7e133137116d",
      "target": "vhdl"
    },
    {
      "path": "qualification/evidence/PROTO-01/wishbone-b4-1.0/cocotb-evidence-v1.json",
      "profile_id": "wishbone-b4-1.0",
      "role": "device",
      "sha256": "981fc722cd6e5758fcbcac632fcc4c2a10175e5d7d0e96a55060d342a7711b1e",
      "target": "cocotb"
    },
    {
      "path": "qualification/evidence/PROTO-01/wishbone-b4-1.0/formal-evidence-v1.json",
      "profile_id": "wishbone-b4-1.0",
      "role": "device",
      "sha256": "7d063a5be392d123b63176cdda1c320505960d3e60b3fa98a6438e7aecfc27c3",
      "target": "formal"
    },
    {
      "path": "qualification/evidence/PROTO-01/wishbone-b4-1.0/systemverilog-evidence-v1.json",
      "profile_id": "wishbone-b4-1.0",
      "role": "device",
      "sha256": "72b7f361fff5e7b653b171b64c36c8d438e8926c5124c1f3a98492bf6d0ad975",
      "target": "systemverilog"
    },
    {
      "path": "qualification/evidence/PROTO-01/wishbone-b4-1.0/verilog-evidence-v1.json",
      "profile_id": "wishbone-b4-1.0",
      "role": "device",
      "sha256": "4ec9530619593bb51c3192e371ee71d9cfe393efa5b56800ac839f79c3c685ce",
      "target": "verilog"
    },
    {
      "path": "qualification/evidence/PROTO-01/wishbone-b4-1.0/vhdl-evidence-v1.json",
      "profile_id": "wishbone-b4-1.0",
      "role": "device",